{
  "schema": "prax-teach/claims-review@1",
  "job_id": "job-741b89d5d0",
  "manifest_sha256": "741b89d5d0d3620c640f19aec79edc350b6b18ea61cf074798d3ca2222b1db4f",
  "rubric_version": "3",
  "reviewer": {"host": "claude-code", "agent": "claims reviewer subagent (Opus 5.5)"},
  "claims": [
    {"id": "c.setup", "verdict": "accept", "reason": "Explanation: framing only. Line 13 calls factorial(3) and line 7 recurses with n - 1 only while n > 1, so for this run it stops at 1. Line numbers check out.", "evidence": ["programs/factorial.c lines 6-7, 13"]},
    {"id": "c.frame", "verdict": "accept", "reason": "Explanation: n and r have automatic storage, and a recursively entered block gets a new instance each time, so each call has its own. The stack picture is clearly scoped as the lesson's drawing. Both quotes match C17.", "evidence": ["C17 §6.2.4 ¶6", "C17 §6.5.2.2 ¶11", "C17 §6.9.1 ¶9"]},
    {"id": "c.waits", "verdict": "accept", "reason": "Explanation: the multiplication on line 7 needs the call's value, which only exists once factorial(2) returns, and factorial(3)'s objects stay alive meanwhile. Output lines 1-2 match.", "evidence": ["C17 §6.8.6.4 ¶3", "C17 §6.5.2.2 ¶5", "C17 §6.2.4 ¶6", "fact f.call3", "fact f.call2"]},
    {"id": "c.depth", "verdict": "accept", "reason": "Maths and explanation: in factorial(2), 2 > 1 holds so line 7 calls factorial(1). factorial(3), factorial(2) and factorial(1) are all active above main, and stdout line 3 is enter factorial(1).", "evidence": ["programs/factorial.c lines 6-7, 13", "fact f.call1"]},
    {"id": "c.base", "verdict": "accept", "reason": "Explanation: with n = 1, 1 > 1 is false, so line 7 is skipped, r keeps 1 from line 5 and line 9 returns it. That matches stdout line 4.", "evidence": ["programs/factorial.c lines 5-9", "fact f.ret1"]},
    {"id": "c.unwind", "verdict": "accept", "reason": "Explanation and maths: a return gives its value to the caller's call expression. factorial(2) computes 2 * 1 = 2, which matches stdout line 5. Every factorial caller is the frame just below it.", "evidence": ["C17 §6.8.6.4 ¶3", "fact f.ret2"]},
    {"id": "c.ret3", "verdict": "accept", "reason": "Maths: 3 * 2 = 6, and main is the caller (line 13). Matches stdout line 6.", "evidence": ["C17 §6.8.6.4 ¶3", "fact f.ret3"]},
    {"id": "c.main", "verdict": "accept", "reason": "Framing that just describes lines 13-14, which its sources show. The value matches the last output line.", "evidence": ["programs/factorial.c lines 13-14", "fact f.l7"]},
    {"id": "c.order", "verdict": "accept", "reason": "Explanation: each call prints its enter line, waits for its callee, then prints its result. So entries come out 3, 2, 1 and results 1, 2, 3, exactly as stdout lines 1-6 show.", "evidence": ["fact f.l1", "fact f.l2", "fact f.l3", "fact f.l4", "fact f.l5", "fact f.l6"]},
    {"id": "c.pause", "verdict": "accept", "reason": "Framing: a predict prompt that states nothing about C.", "evidence": []},
    {"id": "c.recap", "verdict": "accept", "reason": "Explanation: scoped to the lesson's drawing. One live set of n and r per active call, and each return goes to the caller, which is the frame below. Backed by the run.", "evidence": ["C17 §6.2.4 ¶6", "C17 §6.8.6.4 ¶3", "fact f.out"]},
    {"id": "c.slot", "verdict": "accept", "reason": "Framing about the lesson's own notation. Line 7 with n = 3 reads r = 3 * factorial(2), so the empty box stands for the pending call.", "evidence": ["programs/factorial.c line 7", "fact f.call2"]},
    {"id": "c.korder", "verdict": "accept", "reason": "Maths and explanation: all five captured runs count down from n to 1 and then back up, and main gets 1, 2, 6, 24 and 120, which are 1! through 5!. For n = 1 the single call fits trivially.", "evidence": ["fact f.n1.out", "fact f.n2.out", "fact f.out", "fact f.n4.out", "fact f.n5.out"]},
    {"id": "c.kbase1", "verdict": "accept", "reason": "Explanation: with n = 1 the test on line 6 fails, so line 7, the only recursive call, never runs and r = 1 is returned. Matches the fact_n1 run.", "evidence": ["programs/fact_n1.c lines 5-9", "fact f.n1.out"]}
  ],
  "texts": [
    {"id": "t.001", "verdict": "accept", "reason": "First sentence of c.frame, unchanged."},
    {"id": "t.002", "verdict": "accept", "reason": "Same as c.order."},
    {"id": "t.003", "verdict": "accept", "reason": "Second sentence of c.frame, scoped to the lesson."},
    {"id": "t.088", "verdict": "accept", "reason": "True-or-false card built on c.frame, which is true."},
    {"id": "t.089", "verdict": "accept", "reason": "Asked as true or false. The belief is false because main gets 6, not 1 (c.unwind, c.ret3)."},
    {"id": "t.090", "verdict": "accept", "reason": "Asked as true or false. The belief is false because factorial(3) prints its result last (c.order)."},
    {"id": "t.091", "verdict": "accept", "reason": "Asked as true or false. The belief is false because factorial(3) multiplies by 2 and returns 6 (c.ret3)."},
    {"id": "t.092", "verdict": "accept", "reason": "Asked as true or false. The belief is false because factorial(1) never recurses (c.base), and the run has no factorial(0)."},
    {"id": "t.093", "verdict": "accept", "reason": "Same as c.base."},
    {"id": "t.094", "verdict": "accept", "reason": "Same as c.depth."},
    {"id": "t.095", "verdict": "accept", "reason": "Same as c.frame."},
    {"id": "t.096", "verdict": "accept", "reason": "Same as c.kbase1."},
    {"id": "t.097", "verdict": "accept", "reason": "Same as c.korder."},
    {"id": "t.098", "verdict": "accept", "reason": "Same as c.main."},
    {"id": "t.099", "verdict": "accept", "reason": "Same as c.order."},
    {"id": "t.100", "verdict": "accept", "reason": "Same as c.ret3."},
    {"id": "t.101", "verdict": "accept", "reason": "Same as c.setup."},
    {"id": "t.102", "verdict": "accept", "reason": "Same as c.slot."},
    {"id": "t.103", "verdict": "accept", "reason": "Same as c.unwind."},
    {"id": "t.104", "verdict": "accept", "reason": "Same as c.waits."},
    {"id": "t.182", "verdict": "accept", "reason": "Scene title fits sc7, where factorial(3) returns 6 to main."},
    {"id": "t.183", "verdict": "accept", "reason": "Scene title matches c.unwind's 'one frame down'."},
    {"id": "t.184", "verdict": "accept", "reason": "Scene title matches the lesson's drawing in c.frame."},
    {"id": "t.185", "verdict": "accept", "reason": "Neutral scene title for the predict step."},
    {"id": "t.186", "verdict": "accept", "reason": "Neutral scene title."},
    {"id": "t.187", "verdict": "accept", "reason": "Matches c.base: factorial(1) returns 1."},
    {"id": "t.188", "verdict": "accept", "reason": "Matches c.depth: three factorial frames above main."},
    {"id": "t.189", "verdict": "accept", "reason": "Matches line 13 and c.setup."},
    {"id": "t.190", "verdict": "accept", "reason": "Matches c.main: line 14 prints main got 6."},
    {"id": "t.204", "verdict": "accept", "reason": "Lesson title doesn't overstate the claims."},
    {"id": "t.205", "verdict": "accept", "reason": "Shown as a wrong belief, and it is false: main gets 6."},
    {"id": "t.206", "verdict": "accept", "reason": "Shown as a wrong belief, and it is false: results come out 1, 2, 3."},
    {"id": "t.207", "verdict": "accept", "reason": "Shown as a wrong belief, and it is false: recursion stops at factorial(1)."},
    {"id": "t.208", "verdict": "accept", "reason": "Narration matches c.setup."},
    {"id": "t.209", "verdict": "accept", "reason": "Narration matches c.frame."},
    {"id": "t.210", "verdict": "accept", "reason": "Narration matches c.waits. 'Now' adds nothing new."},
    {"id": "t.211", "verdict": "accept", "reason": "Narration matches c.slot."},
    {"id": "t.212", "verdict": "accept", "reason": "Narration matches c.depth."},
    {"id": "t.213", "verdict": "accept", "reason": "Narration matches c.pause. It's tied to the video and its captions and transcript, so 'plays' fits."},
    {"id": "t.214", "verdict": "accept", "reason": "Narration matches c.base."},
    {"id": "t.215", "verdict": "accept", "reason": "Narration matches c.unwind."},
    {"id": "t.216", "verdict": "accept", "reason": "Narration matches c.ret3."},
    {"id": "t.217", "verdict": "accept", "reason": "Narration matches c.main."},
    {"id": "t.218", "verdict": "accept", "reason": "Narration matches c.order."},
    {"id": "t.219", "verdict": "accept", "reason": "First sentence of c.recap, scope kept."},
    {"id": "t.220", "verdict": "accept", "reason": "Second sentence of c.recap, word for word, and it follows the scoped sentence."},
    {"id": "t.221", "verdict": "accept", "reason": "Marked wrong, and it is wrong: factorial(3) = 6 is output line 6, not line 4."},
    {"id": "t.222", "verdict": "accept", "reason": "Marked correct, and it is: output line 4 is factorial(1) = 1 (f.l4)."},
    {"id": "t.223", "verdict": "accept", "reason": "Marked wrong, and it is wrong: factorial(0) is never called."},
    {"id": "t.224", "verdict": "accept", "reason": "The prompt doesn't give away the answer."},
    {"id": "t.225", "verdict": "accept", "reason": "Trace s0: main is waiting at line 13 and factorial(3) is running at line 4."},
    {"id": "t.226", "verdict": "accept", "reason": "Trace s1: factorial(3) is waiting at line 7 and factorial(2) is running."},
    {"id": "t.227", "verdict": "accept", "reason": "Trace s2: main plus three factorial frames."},
    {"id": "t.228", "verdict": "accept", "reason": "Trace s3: factorial(1) is at line 9 returning 1, and output line 4 is printed."},
    {"id": "t.229", "verdict": "accept", "reason": "Trace s4: factorial(2) got 1 and is returning 2."},
    {"id": "t.230", "verdict": "accept", "reason": "Trace s5: factorial(3) got 2 and is returning 6."},
    {"id": "t.231", "verdict": "accept", "reason": "Trace s6: main is at line 14 with 6, and output line 7 is printed."}
  ],
  "overall": "accept"
}
