{
  "schema": "prax-teach/claims-review@1",
  "job_id": "job-b88b786aab",
  "manifest_sha256": "b88b786aaba38e77a163888951e9c08831b7def5bd549dd7f1d48268f23ee624",
  "rubric_version": "3",
  "reviewer": {"host": "claude-code", "agent": "claims reviewer subagent, rubric v3, job file only"},
  "claims": [
    {"id": "c.setup", "verdict": "accept", "reason": "Explanation: framing only. Line 13 calls factorial(3), and line 7 recurses with n - 1 only while n > 1, so recursion stops at n = 1.", "evidence": ["programs/factorial.c lines 6-7, 13"]},
    {"id": "c.frame", "verdict": "accept", "reason": "Explanation: a recursive entry creates new instances of the automatic objects n and r, and the frame picture is clearly scoped to this lesson's drawing. Both quotes are accurate.", "evidence": ["C17 §6.2.4 ¶6", "C17 §6.5.2.2 ¶11", "C17 §6.9.1 ¶9"]},
    {"id": "c.waits", "verdict": "accept", "reason": "Explanation: the multiply on line 7 needs the value of the call, and that value only exists once the callee returns. factorial(3)'s n and r stay alive meanwhile. The output order matches.", "evidence": ["C17 §6.8.6.4 ¶3", "C17 §6.5.2.2 ¶5", "C17 §6.2.4 ¶6", "fact f.call3", "fact f.call2"]},
    {"id": "c.depth", "verdict": "accept", "reason": "Maths and explanation: with n = 2 the test holds, so line 7 calls factorial(1). factorial(3), factorial(2) and main are all still waiting. Stdout line 3 is enter factorial(1).", "evidence": ["programs/factorial.c lines 6-7, 13", "fact f.call1"]},
    {"id": "c.base", "verdict": "accept", "reason": "Explanation: 1 > 1 is false, so line 7 is skipped, r keeps 1 from line 5, and line 9 returns it. That matches stdout line 4.", "evidence": ["programs/factorial.c lines 5-9", "fact f.ret1"]},
    {"id": "c.unwind", "verdict": "accept", "reason": "Maths and explanation: a return value goes back to the caller as the value of the call expression, and 2 * 1 = 2 matches stdout line 5.", "evidence": ["C17 §6.8.6.4 ¶3", "fact f.ret2"]},
    {"id": "c.ret3", "verdict": "accept", "reason": "Maths: 3 * 2 = 6, returned to main's call on line 13. Matches stdout line 6.", "evidence": ["C17 §6.8.6.4 ¶3", "fact f.ret3"]},
    {"id": "c.main", "verdict": "accept", "reason": "Explanation: line 13 initialises main's r from the call and line 14 prints it. The last stdout line is main got 6. The mechanism is covered by c.ret3.", "evidence": ["programs/factorial.c lines 13-14", "fact f.l7"]},
    {"id": "c.order", "verdict": "accept", "reason": "Maths and explanation: each call prints enter first and its result only after its callee returns, so stdout lines 1-6 show 3, 2, 1 then 1, 2, 3. The waiting mechanism is in c.waits.", "evidence": ["fact f.l1", "fact f.l2", "fact f.l3", "fact f.l4", "fact f.l5", "fact f.l6"]},
    {"id": "c.pause", "verdict": "accept", "reason": "Explanation: a predict prompt that only orients the learner and makes no claim about C.", "evidence": ["AGENTS.md Teaching"]},
    {"id": "c.recap", "verdict": "accept", "reason": "Explanation: scoped to the lesson's drawing. One new set of n and r per call, gone at return, and each value goes to the caller.", "evidence": ["C17 §6.2.4 ¶6", "C17 §6.8.6.4 ¶3"]},
    {"id": "c.slot", "verdict": "accept", "reason": "Explanation: this describes the lesson's own notation for line 7 with n = 3 while factorial(2) is still pending. It makes no claim about C.", "evidence": ["programs/factorial.c line 7", "fact f.call2"]},
    {"id": "c.korder", "verdict": "accept", "reason": "Maths: the five captured runs show entries n down to 1, results 1 up to n, and main got 1, 2, 6, 24, 120, which are 1! to 5!. For n = 1 the single call is a trivial case of the pattern.", "evidence": ["fact f.n1.out", "fact f.n2.out", "fact f.out", "fact f.n4.out", "fact f.n5.out"]},
    {"id": "c.kbase1", "verdict": "accept", "reason": "Explanation: with n = 1 the test on line 6 fails, so the only recursive call on line 7 never runs, and r = 1 is returned. Matches the fact_n1 run.", "evidence": ["programs/fact_n1.c lines 5-9", "fact f.n1.out"]}
  ],
  "texts": [
    {"id": "t.001", "verdict": "accept", "reason": "First sentence of c.frame, unchanged."},
    {"id": "t.002", "verdict": "accept", "reason": "Same as c.order."},
    {"id": "t.003", "verdict": "accept", "reason": "Second sentence of c.frame, keeps the lesson-drawing scope."},
    {"id": "t.088", "verdict": "accept", "reason": "True-or-false card with the true c.frame statement, worded the same."},
    {"id": "t.089", "verdict": "accept", "reason": "Shows m.base for the learner to reject. It is false, because main gets 6 (c.unwind, c.ret3)."},
    {"id": "t.090", "verdict": "accept", "reason": "Shows m.firstdone as a card to judge. It is false, because factorial(3) prints its result last (c.order)."},
    {"id": "t.091", "verdict": "accept", "reason": "Shows m.once as a card to judge. It is false, because factorial(3) returns 6 (c.ret3)."},
    {"id": "t.092", "verdict": "accept", "reason": "Shows m.zero as a card to judge. It is false, because recursion stops at factorial(1) (c.base)."},
    {"id": "t.093", "verdict": "accept", "reason": "Same as c.base."},
    {"id": "t.094", "verdict": "accept", "reason": "Same as c.depth."},
    {"id": "t.095", "verdict": "accept", "reason": "Same as c.frame."},
    {"id": "t.096", "verdict": "accept", "reason": "Same as c.kbase1."},
    {"id": "t.097", "verdict": "accept", "reason": "Same as c.korder."},
    {"id": "t.098", "verdict": "accept", "reason": "Same as c.main."},
    {"id": "t.099", "verdict": "accept", "reason": "Same as c.order."},
    {"id": "t.100", "verdict": "accept", "reason": "Same as c.ret3."},
    {"id": "t.101", "verdict": "accept", "reason": "Same as c.setup."},
    {"id": "t.102", "verdict": "accept", "reason": "Same as c.slot."},
    {"id": "t.103", "verdict": "accept", "reason": "Same as c.unwind."},
    {"id": "t.104", "verdict": "accept", "reason": "Same as c.waits."},
    {"id": "t.182", "verdict": "accept", "reason": "Title for the scene where factorial(3) returns 6 to main. Matches c.ret3."},
    {"id": "t.183", "verdict": "accept", "reason": "Matches c.unwind's one frame down wording."},
    {"id": "t.184", "verdict": "accept", "reason": "Matches the lesson's drawing in c.frame and c.recap."},
    {"id": "t.185", "verdict": "accept", "reason": "Plain label for the predict scene."},
    {"id": "t.186", "verdict": "accept", "reason": "Plain label for the recap scene."},
    {"id": "t.187", "verdict": "accept", "reason": "Matches c.base: factorial(1) returns 1."},
    {"id": "t.188", "verdict": "accept", "reason": "Three factorial frames on top of main, as c.depth says. Doesn't overstate."},
    {"id": "t.189", "verdict": "accept", "reason": "Matches c.setup and line 13."},
    {"id": "t.190", "verdict": "accept", "reason": "Matches c.main and line 14."},
    {"id": "t.204", "verdict": "accept", "reason": "Lesson title fits the content and doesn't overstate it."},
    {"id": "t.205", "verdict": "accept", "reason": "m.base, labelled as a wrong belief, and it is false."},
    {"id": "t.206", "verdict": "accept", "reason": "m.firstdone, labelled as a wrong belief, and it is false."},
    {"id": "t.207", "verdict": "accept", "reason": "m.zero, labelled as a wrong belief, and it is false."},
    {"id": "t.208", "verdict": "accept", "reason": "Narration same as c.setup."},
    {"id": "t.209", "verdict": "accept", "reason": "Narration same as c.frame."},
    {"id": "t.210", "verdict": "accept", "reason": "Narration same as c.waits with a lead-in word."},
    {"id": "t.211", "verdict": "accept", "reason": "Narration same as c.slot."},
    {"id": "t.212", "verdict": "accept", "reason": "Narration same as c.depth with a lead-in word."},
    {"id": "t.213", "verdict": "accept", "reason": "Narration same as c.pause."},
    {"id": "t.214", "verdict": "accept", "reason": "Narration same as c.base."},
    {"id": "t.215", "verdict": "accept", "reason": "Narration same as c.unwind."},
    {"id": "t.216", "verdict": "accept", "reason": "Narration same as c.ret3 with a lead-in word."},
    {"id": "t.217", "verdict": "accept", "reason": "Narration same as c.main."},
    {"id": "t.218", "verdict": "accept", "reason": "Narration same as c.order."},
    {"id": "t.219", "verdict": "accept", "reason": "First sentence of c.recap, keeps the lesson-drawing scope."},
    {"id": "t.220", "verdict": "accept", "reason": "Second sentence of c.recap, unchanged."},
    {"id": "t.221", "verdict": "accept", "reason": "Marked wrong and is wrong: factorial(3) = 6 is line 6, not line 4."},
    {"id": "t.222", "verdict": "accept", "reason": "Marked correct and matches fact f.l4."},
    {"id": "t.223", "verdict": "accept", "reason": "Marked wrong and is wrong: factorial(0) is never called."},
    {"id": "t.224", "verdict": "accept", "reason": "The prompt doesn't give away the answer."},
    {"id": "t.225", "verdict": "accept", "reason": "True for s0: main waiting on line 13 and factorial(3) running at line 4."},
    {"id": "t.226", "verdict": "accept", "reason": "True for s1: factorial(3) waiting on line 7 while factorial(2) runs."},
    {"id": "t.227", "verdict": "accept", "reason": "True for s2: three factorial frames above main."},
    {"id": "t.228", "verdict": "accept", "reason": "True for s3: factorial(1) at line 9 returning 1."},
    {"id": "t.229", "verdict": "accept", "reason": "True for s4: factorial(2) got 1 and returns 2."},
    {"id": "t.230", "verdict": "accept", "reason": "True for s5: factorial(3) got 2 and returns 6."},
    {"id": "t.231", "verdict": "accept", "reason": "True for s6: main at line 14 got 6 and prints it."}
  ],
  "overall": "accept"
}
