{
  "schema": "prax-teach/claims-review@1",
  "job_id": "job-8527c54049",
  "manifest_sha256": "8527c54049714431ec1220be2b33d6af30faa2554827afed302104da92bc3b03",
  "rubric_version": "3",
  "reviewer": {"host": "claude-code", "agent": "claims reviewer subagent (Opus 5.5)"},
  "claims": [
    {"id": "c.setup", "verdict": "accept", "reason": "Explanation: line 13 calls factorial(3) and line 7 recurses with n - 1 only while n > 1 (line 6), so this program stops at n = 1. Line numbers check out.", "evidence": ["programs/factorial.c lines 6-7, 13"]},
    {"id": "c.frame", "verdict": "accept", "reason": "Explanation: n and r are automatic objects and a recursive entry makes a new instance each time. The stack picture is scoped to the lesson's drawing. Both quotes are accurate.", "evidence": ["C17 §6.2.4 ¶6", "C17 §6.5.2.2 ¶11"]},
    {"id": "c.waits", "verdict": "accept", "reason": "Explanation: the multiplication on line 7 needs the call's value, which exists only once factorial(2) returns, and factorial(3)'s objects stay alive meanwhile. The frame wording uses the drawing c.frame sets up.", "evidence": ["C17 §6.8.6.4 ¶3", "C17 §6.2.4 ¶6", "fact f.call3", "fact f.call2"]},
    {"id": "c.depth", "verdict": "accept", "reason": "Explanation: with n = 2 the test passes and factorial(1) is called while factorial(3) and factorial(2) still wait, so the drawing shows three factorial frames over main.", "evidence": ["programs/factorial.c lines 6-7, 13", "fact f.call1"]},
    {"id": "c.base", "verdict": "accept", "reason": "Maths and explanation: n > 1 is false for n = 1, line 7 is skipped, r keeps 1 from line 5 and line 9 returns it.", "evidence": ["programs/factorial.c lines 5-9", "fact f.ret1"]},
    {"id": "c.unwind", "verdict": "reject", "reason": "Explanation: the first sentence is false. A return hands its value to its caller, not straight to main, and no frames are skipped. factorial(1) returns to factorial(2), as the claim's own justification and §6.8.6.4 ¶3 say. The sentence also teaches misconception m.base.", "evidence": ["C17 §6.8.6.4 ¶3", "misconception m.base", "fact f.ret2"]},
    {"id": "c.ret3", "verdict": "accept", "reason": "Maths and explanation: factorial(3) gets 2 from factorial(2) and computes 3 * 2 = 6, and main is its caller, so 6 goes to main.", "evidence": ["C17 §6.8.6.4 ¶3", "fact f.ret3"]},
    {"id": "c.main", "verdict": "accept", "reason": "Framing: line 13 puts the value in main's r and line 14 prints it. Matches the last output line.", "evidence": ["programs/factorial.c lines 13-14", "fact f.l7"]},
    {"id": "c.order", "verdict": "accept", "reason": "Explanation: each call prints its enter line before recursing and its result line after the callee returns, so entries go 3, 2, 1 and results 1, 2, 3. All six lines match.", "evidence": ["fact f.l1", "fact f.l2", "fact f.l3", "fact f.l4", "fact f.l5", "fact f.l6"]},
    {"id": "c.pause", "verdict": "accept", "reason": "Framing: a prediction prompt that states nothing about C.", "evidence": []},
    {"id": "c.recap", "verdict": "accept", "reason": "Explanation: scoped to the lesson's drawing. One new set of n and r per call, gone at return, and each value goes to the caller, which the drawing puts just below.", "evidence": ["C17 §6.2.4 ¶6", "C17 §6.8.6.4 ¶3"]},
    {"id": "c.slot", "verdict": "accept", "reason": "Framing: describes the lesson's own notation for the pending call on line 7 and makes no claim about C.", "evidence": ["programs/factorial.c line 7", "fact f.call2"]},
    {"id": "c.korder", "verdict": "accept", "reason": "Maths and explanation: for n = 1..5 the entries count down from n to 1 and the results come back up, and main gets 1, 2, 6, 24, 120, which are n!. No int overflow at these sizes.", "evidence": ["fact f.n1.out", "fact f.n2.out", "fact f.out", "fact f.n4.out", "fact f.n5.out"]},
    {"id": "c.kbase1", "verdict": "accept", "reason": "Explanation: with n = 1 the test on line 6 fails, so line 7, the only recursive call, never runs and r = 1 is returned. It is scoped to calls to factorial, not printf.", "evidence": ["programs/fact_n1.c lines 5-9", "fact f.n1.out"]}
  ],
  "texts": [
    {"id": "t.001", "verdict": "accept", "reason": "Matches c.frame."},
    {"id": "t.002", "verdict": "accept", "reason": "Matches c.order."},
    {"id": "t.003", "verdict": "accept", "reason": "Matches the drawing sentence of c.frame."},
    {"id": "t.088", "verdict": "accept", "reason": "True-or-false card stating c.frame, which is true."},
    {"id": "t.089", "verdict": "reject", "reason": "The belief is false, but its only backing claim, c.unwind, says returns go straight to main, which supports the belief. The card has no valid correction."},
    {"id": "t.090", "verdict": "accept", "reason": "Shows m.firstdone as a card to judge. It is false, and c.order backs that."},
    {"id": "t.091", "verdict": "accept", "reason": "Shows m.once as a card to judge. It is false, since factorial(3) returns 6 per c.ret3."},
    {"id": "t.092", "verdict": "accept", "reason": "Shows m.zero as a card to judge. It is false, since recursion stops at factorial(1) per c.base."},
    {"id": "t.093", "verdict": "accept", "reason": "Same as c.base."},
    {"id": "t.094", "verdict": "accept", "reason": "Same as c.depth."},
    {"id": "t.095", "verdict": "accept", "reason": "Same as c.frame."},
    {"id": "t.096", "verdict": "accept", "reason": "Same as c.kbase1."},
    {"id": "t.097", "verdict": "accept", "reason": "Same as c.korder."},
    {"id": "t.098", "verdict": "accept", "reason": "Same as c.main."},
    {"id": "t.099", "verdict": "accept", "reason": "Same as c.order."},
    {"id": "t.100", "verdict": "accept", "reason": "Same as c.ret3."},
    {"id": "t.101", "verdict": "accept", "reason": "Same as c.setup."},
    {"id": "t.102", "verdict": "accept", "reason": "Same as c.slot."},
    {"id": "t.103", "verdict": "reject", "reason": "Repeats c.unwind's false line that each return goes straight to main and skips the frames in between. Returns go to the caller."},
    {"id": "t.104", "verdict": "accept", "reason": "Same as c.waits."},
    {"id": "t.182", "verdict": "accept", "reason": "Scene title fits sc7, where factorial(3) returns 6 to main."},
    {"id": "t.183", "verdict": "accept", "reason": "Scene title fits a return going one frame down to its caller."},
    {"id": "t.184", "verdict": "accept", "reason": "Fits c.frame's drawing."},
    {"id": "t.185", "verdict": "accept", "reason": "Neutral scene title."},
    {"id": "t.186", "verdict": "accept", "reason": "Neutral scene title."},
    {"id": "t.187", "verdict": "accept", "reason": "Fits c.base."},
    {"id": "t.188", "verdict": "accept", "reason": "Fits c.depth: three factorial frames."},
    {"id": "t.189", "verdict": "accept", "reason": "Fits c.setup."},
    {"id": "t.190", "verdict": "accept", "reason": "Fits c.main."},
    {"id": "t.204", "verdict": "accept", "reason": "The title matches the lesson's stated drawing and doesn't overstate."},
    {"id": "t.205", "verdict": "reject", "reason": "The wrong-belief label is right, but the mapped correction c.unwind says returns go straight to main, which supports the belief. The label has no valid correction."},
    {"id": "t.206", "verdict": "accept", "reason": "Labelled as a wrong belief. It is false per c.order."},
    {"id": "t.207", "verdict": "accept", "reason": "Labelled as a wrong belief. It is false per c.base."},
    {"id": "t.208", "verdict": "accept", "reason": "Same as c.setup."},
    {"id": "t.209", "verdict": "accept", "reason": "Same as c.frame."},
    {"id": "t.210", "verdict": "accept", "reason": "Same as c.waits with a lead-in word."},
    {"id": "t.211", "verdict": "accept", "reason": "Same as c.slot."},
    {"id": "t.212", "verdict": "accept", "reason": "Same as c.depth with a lead-in word."},
    {"id": "t.213", "verdict": "accept", "reason": "Same as c.pause."},
    {"id": "t.214", "verdict": "accept", "reason": "Same as c.base."},
    {"id": "t.215", "verdict": "reject", "reason": "Narrates c.unwind's false line that each return goes straight to main. It also contradicts the recap in t.220."},
    {"id": "t.216", "verdict": "accept", "reason": "Same as c.ret3 with a lead-in word."},
    {"id": "t.217", "verdict": "accept", "reason": "Same as c.main."},
    {"id": "t.218", "verdict": "accept", "reason": "Same as c.order."},
    {"id": "t.219", "verdict": "accept", "reason": "First sentence of c.recap, scope kept."},
    {"id": "t.220", "verdict": "accept", "reason": "Second sentence of c.recap. It follows t.219's drawing scope and is true."},
    {"id": "t.221", "verdict": "accept", "reason": "Marked wrong and is wrong: factorial(3) = 6 is line 6, not line 4."},
    {"id": "t.222", "verdict": "accept", "reason": "Marked correct and matches fact f.l4."},
    {"id": "t.223", "verdict": "accept", "reason": "Marked wrong and is wrong: factorial(0) is never called."},
    {"id": "t.224", "verdict": "accept", "reason": "The prompt doesn't give away f.l4."},
    {"id": "t.225", "verdict": "accept", "reason": "True for s0: main waits on line 13 and factorial(3) runs."},
    {"id": "t.226", "verdict": "accept", "reason": "True for s1: factorial(3) waits on line 7 while factorial(2) runs."},
    {"id": "t.227", "verdict": "accept", "reason": "True for s2: three factorial frames above main."},
    {"id": "t.228", "verdict": "accept", "reason": "True for s3: factorial(1) at line 9 with ret 1."},
    {"id": "t.229", "verdict": "accept", "reason": "True for s4: factorial(2) at line 9 with ret 2."},
    {"id": "t.230", "verdict": "accept", "reason": "True for s5: factorial(3) at line 9 with ret 6."},
    {"id": "t.231", "verdict": "accept", "reason": "True for s6: main runs line 14 holding 6."}
  ],
  "overall": "reject"
}
