{
  "schema": "prax-teach/claims-review@1",
  "job_id": "job-82cfc44036",
  "manifest_sha256": "82cfc44036b35fa27d1f4f2fb91682ee7287be5574746254431304f84fcfe691",
  "rubric_version": "4",
  "reviewer": {"host": "claude-code", "agent": "claims reviewer subagent (Opus), independent read of job and rubric v4"},
  "claims": [
    {"id": "c.formula", "verdict": "accept", "reason": "Framing: neuron.c lines 8, 10, 12 and 14 do multiply, add t1 + t2 + b and apply fmax(0.0, z); the stored passage defines ReLU as max{0, z}. Line numbers in the justification are right.", "evidence": ["passage sources/dl-6.3.1-relu.txt", "program p1 lines 8-14"]},
    {"id": "c.setup", "verdict": "accept", "reason": "Maths: lines 5-7 set 0.8, 1.5, 0.4, -1.0, -0.2 and %g prints them as 0.8, 1.5, 0.4, -1, -0.2, matching the listed facts.", "evidence": ["fact f.x1", "fact f.w1", "fact f.x2", "fact f.w2", "fact f.b"]},
    {"id": "c.mul", "verdict": "reject", "reason": "Maths: the text says \"0.4 × -1 = +0.4\", but 0.4 * -1.0 is -0.4 and fact f.t2 is -0.4. The justification itself derives -0.4, so the claim contradicts its own justification and the captured run.", "evidence": ["fact f.t2", "fact f.l2", "program p1 line 10"]},
    {"id": "c.sign", "verdict": "accept", "reason": "Explanation: scoped by \"Here\"; 0.4 * -1.0 is negative and the run prints -0.4.", "evidence": ["fact f.t2", "program p1 line 10"]},
    {"id": "c.add", "verdict": "accept", "reason": "Maths and mechanism: recomputed in binary64, t1 = 1.2000000000000002, t1 + t2 = 0.8000000000000002, plus b gives 0.6000000000000001 (the double just above 0.6), which %g prints as 0.6; the text states the printed values only.", "evidence": ["fact f.z", "fact f.l3", "program p1 line 12"]},
    {"id": "c.relu", "verdict": "accept", "reason": "Definition matches the stored passage g(z) = max{0, z}; the fmax passage supports line 14, and the justification's z = 0 case is true.", "evidence": ["passage sources/dl-6.3.1-relu.txt", "passage sources/n2310-7.12.12.2p3.txt"]},
    {"id": "c.out", "verdict": "accept", "reason": "Mechanism: z is 0.6000000000000001, positive, so fmax(0.0, z) returns z and %g prints 0.6, matching f.a.", "evidence": ["fact f.a", "fact f.l4", "program p1 lines 14-15"]},
    {"id": "c.toy", "verdict": "accept", "reason": "Framing: the neuron programs declare every quantity double and print with %g or %+g; with precision omitted P = 6, so at most 6 significant digits, as the stored ¶8 passage says.", "evidence": ["passage sources/n2310-7.21.6.1p8-g.txt", "program p1 lines 5-15"]},
    {"id": "c.pause", "verdict": "accept", "reason": "Framing: sc4 narrates z = 0.6 and sc5 narrates a = 0.6, so the next scenes do answer the sc3 question; states no C fact.", "evidence": ["scenes sc3, sc4, sc5"]},
    {"id": "c.round", "verdict": "accept", "reason": "Caveat scoped to this machine. Recomputed: 0.8 * 1.5 = 1.2000000000000002, z = 0.6000000000000001, z == 0.6 false; EXAMPLE 2 passage lists FLT_RADIX 2, DBL_MANT_DIG 53, DBL_MIN_EXP -1021, DBL_MAX_EXP +1024, matching p5's facts.", "evidence": ["passage sources/n2310-5.2.4.2.2-example2.txt", "passage sources/n2310-7.21.6.1p8-g.txt", "fact f.radix", "fact f.mantdig", "fact f.minexp", "fact f.maxexp", "fact f.z"]},
    {"id": "c.kzero", "verdict": "accept", "reason": "Maths: for p2, t1 + t2 + (-1) = -0.19999999999999984, printed -0.2, and fmax(0.0, negative) = 0, matching f.k1.t1, f.k1.z, f.k1.a; c.relu supplies the mechanism.", "evidence": ["fact f.k1.t1", "fact f.k1.z", "fact f.k1.a"]},
    {"id": "c.kformula", "verdict": "reject", "reason": "Maths: the slider ranges (w2 from -2 to 2, b from -1 to 1) and the 0.1 step are values that appear in no fact, program or stored passage in the job; the justification cites figure.explore.sliders and ptk/expect_neuron.py, which are not provided, so the ranges and the claim that each slider value is the nearest double cannot be checked.", "evidence": ["program p1 lines 5-14", "facts f.k1.z, f.k2.z, f.k3.z"]}
  ],
  "texts": [
    {"id": "t.001", "verdict": "accept", "reason": "alt: same as c.toy's first sentence."},
    {"id": "t.002", "verdict": "accept", "reason": "alt: same as c.toy's second sentence; on the still 'the program' is the one shown."},
    {"id": "t.003", "verdict": "accept", "reason": "alt: same as c.formula."},
    {"id": "t.084", "verdict": "accept", "reason": "template: rule card for c.relu, true as worded."},
    {"id": "t.085", "verdict": "accept", "reason": "template: rule card for c.round, scoped 'On this machine', values recomputed and correct."},
    {"id": "t.086", "verdict": "accept", "reason": "template presenting m.negterm as a wrong belief; it is false (in neuron.c a term is -0.4 yet a = 0.6) and the card marks it False."},
    {"id": "t.087", "verdict": "accept", "reason": "template presenting m.nobias as a wrong belief; the bias is in the sum (line 12), so it is false and the card marks it False."},
    {"id": "t.088", "verdict": "accept", "reason": "claim: same as c.add; the printed values identify the lesson's neuron in every place listed."},
    {"id": "t.089", "verdict": "accept", "reason": "claim: same as c.formula."},
    {"id": "t.090", "verdict": "reject", "reason": "claim: same text as c.kformula, which is rejected; slider ranges and step are unsupported by anything in the job (explorer/index.html (try another value))."},
    {"id": "t.091", "verdict": "accept", "reason": "claim: same as c.kzero; on cards out:p2 it matches p2's captured output."},
    {"id": "t.092", "verdict": "reject", "reason": "claim: same as c.mul; '0.4 × -1 = +0.4' is wrong, the product is -0.4 (fact f.t2), shown at explorer/index.html step 2."},
    {"id": "t.093", "verdict": "accept", "reason": "claim: same as c.out; 'Here' points at neuron.c on the predict card and at state s3 in explorer step 4."},
    {"id": "t.094", "verdict": "accept", "reason": "claim: same as c.relu, a general definition true in every place."},
    {"id": "t.095", "verdict": "accept", "reason": "claim: same as c.setup; explorer step 1 shows state s0 at line 7."},
    {"id": "t.096", "verdict": "accept", "reason": "claim: same as c.sign; step 2 state s1 shows the -0.4 line."},
    {"id": "t.097", "verdict": "accept", "reason": "claim: same as c.toy, on the still with the program shown."},
    {"id": "t.170", "verdict": "accept", "reason": "chapter-title: sc4 state s2 runs line 12 and prints z."},
    {"id": "t.171", "verdict": "accept", "reason": "chapter-title: sc5 state s3 runs fmax on line 14 and prints a."},
    {"id": "t.172", "verdict": "accept", "reason": "chapter-title: sc2 state s1 shows the two products."},
    {"id": "t.173", "verdict": "accept", "reason": "chapter-title: sc1 narration names three steps: multiply, add bias, gate with ReLU."},
    {"id": "t.174", "verdict": "accept", "reason": "chapter-title: sc6 restates the printed result and the formula; no value overstated."},
    {"id": "t.175", "verdict": "accept", "reason": "chapter-title: names the question scene without giving away the answer."},
    {"id": "t.187", "verdict": "accept", "reason": "lesson-title: names the lesson without overstating."},
    {"id": "t.188", "verdict": "accept", "reason": "misconception shown labelled as a wrong belief; it is false per c.relu and neuron.c's run."},
    {"id": "t.189", "verdict": "accept", "reason": "misconception shown labelled as a wrong belief; false per c.add."},
    {"id": "t.190", "verdict": "accept", "reason": "narration: same as c.formula, reads true in captions, IVE and transcript."},
    {"id": "t.191", "verdict": "accept", "reason": "narration: same as c.setup; matches state s0."},
    {"id": "t.192", "verdict": "reject", "reason": "narration: '0.4 × -1 = +0.4' is wrong; the product is -0.4 (fact f.t2) and sc2's state s1 shows -0.4, so it breaks in captions.vtt, ive/index.html and transcript.txt."},
    {"id": "t.193", "verdict": "accept", "reason": "narration: same as c.sign; 'Here' is sc2's state s1."},
    {"id": "t.194", "verdict": "accept", "reason": "narration: sc4 and sc5 give z and a; transcript.txt prints the prompt just before, so 'this question' resolves there too."},
    {"id": "t.195", "verdict": "accept", "reason": "narration: same as c.add; matches sc4 state s2."},
    {"id": "t.196", "verdict": "accept", "reason": "narration: same as c.relu."},
    {"id": "t.197", "verdict": "accept", "reason": "narration: same as c.out; 'Here' is sc5 state s3."},
    {"id": "t.198", "verdict": "accept", "reason": "narration: c.round's first half, scoped to this machine; values recomputed."},
    {"id": "t.199", "verdict": "accept", "reason": "narration: c.round's second half; follows t.198 in sc6, which names z."},
    {"id": "t.200", "verdict": "accept", "reason": "narration: same as c.formula."},
    {"id": "t.201", "verdict": "accept", "reason": "option: 0.8 marked wrong; a prints 0.6 (f.a)."},
    {"id": "t.202", "verdict": "accept", "reason": "option: 0 marked wrong; a prints 0.6 (f.a)."},
    {"id": "t.203", "verdict": "accept", "reason": "option: 0.6 marked correct; matches f.a."},
    {"id": "t.204", "verdict": "accept", "reason": "question: makes sense with or without options; no prior narration or title gives away 0.6."},
    {"id": "t.205", "verdict": "accept", "reason": "trace-label: s0 covers lines 5-7, the inputs, weights and bias."},
    {"id": "t.206", "verdict": "accept", "reason": "trace-label: s1 covers lines 8-11, the two products."},
    {"id": "t.207", "verdict": "accept", "reason": "trace-label: s2 covers line 12-13, the sum with the bias."},
    {"id": "t.208", "verdict": "accept", "reason": "trace-label: s3 covers lines 14-15, fmax(0.0, z)."}
  ],
  "overall": "reject"
}
