{
  "schema": "prax-teach/claims-review@1",
  "job_id": "job-4e533fa639",
  "manifest_sha256": "4e533fa6392dad73ab7a9365cbc77f1558d8d7aaa8acac2751ca33ffe7e5986a",
  "rubric_version": "3",
  "reviewer": {"host": "claude-code", "agent": "claims reviewer subagent, rubric v3"},
  "claims": [
    {"id": "c.setup", "verdict": "accept", "reason": "Explanation: true for this program. Line 13 calls factorial(3), and line 7 recurses with n - 1 only while n > 1 (line 6). It only orients, as a framing claim should.", "evidence": ["programs/factorial.c lines 6-7, 13"]},
    {"id": "c.frame", "verdict": "accept", "reason": "Explanation: each recursive entry creates new instances of the automatic objects n and r. The stack picture is clearly scoped to the lesson's drawing, and both quotes are accurate.", "evidence": ["C17 §6.2.4 ¶6", "C17 §6.9.1 ¶9", "C17 §6.5.2.2 ¶11"]},
    {"id": "c.waits", "verdict": "accept", "reason": "Explanation: the multiplication on line 7 needs the value of the call, so factorial(3) can't finish that line until factorial(2) returns. Its n and r still exist meanwhile. The cited clauses say this, and the order of stdout lines 1-2 matches.", "evidence": ["C17 §6.5.2.2 ¶5", "C17 §6.8.6.4 ¶3", "C17 §6.2.4 ¶6", "fact f.call3", "fact f.call2"]},
    {"id": "c.depth", "verdict": "accept", "reason": "Maths and explanation: factorial(3), factorial(2) and factorial(1) are all active above main, so the count of three is right. stdout line 3 is enter factorial(1).", "evidence": ["programs/factorial.c lines 6-7, 13", "fact f.call1"]},
    {"id": "c.base", "verdict": "accept", "reason": "Explanation: with n = 1 the test on line 6 fails and line 7 is skipped. r keeps the 1 from line 5 and line 9 returns it, which matches fact f.ret1.", "evidence": ["programs/factorial.c lines 5-9", "fact f.ret1"]},
    {"id": "c.unwind", "verdict": "accept", "reason": "Maths and explanation: a return value goes to the caller as the value of the call expression. In factorial(2), 2 * 1 = 2, which matches f.ret2. 'One frame down' is the lesson's drawing.", "evidence": ["C17 §6.8.6.4 ¶3", "fact f.ret2"]},
    {"id": "c.ret3", "verdict": "accept", "reason": "Maths: 3 * 2 = 6, which matches f.ret3. The value goes back to main, which made the call on line 13.", "evidence": ["C17 §6.8.6.4 ¶3", "fact f.ret3"]},
    {"id": "c.main", "verdict": "accept", "reason": "Explanation: line 13 initialises main's own r with 6 and line 14 prints it, which matches f.l7.", "evidence": ["programs/factorial.c lines 13-14", "fact f.l7"]},
    {"id": "c.order", "verdict": "accept", "reason": "Maths: stdout lines 1-3 enter 3, 2, 1, and lines 4-6 finish 1, 2, 3, exactly as the facts say. c.waits and c.unwind supply the mechanism.", "evidence": ["fact f.l1", "fact f.l2", "fact f.l3", "fact f.l4", "fact f.l5", "fact f.l6"]},
    {"id": "c.pause", "verdict": "accept", "reason": "Kind fits: it's a pure retrieval prompt and says nothing about C. Where the narration copy appears is checked under t.213.", "evidence": ["AGENTS.md Teaching"]},
    {"id": "c.recap", "verdict": "accept", "reason": "Explanation: it is scoped to the lesson's drawing. The new n and r per call live until that call ends, and each return value goes to the caller.", "evidence": ["C17 §6.2.4 ¶6", "C17 §6.8.6.4 ¶3"]},
    {"id": "c.slot", "verdict": "accept", "reason": "Kind fits: it only describes the lesson's own notation for the pending call on line 7.", "evidence": ["programs/factorial.c line 7", "fact f.call2"]},
    {"id": "c.korder", "verdict": "accept", "reason": "Maths: the captured runs for n = 1 to 5 show entries counting down, results counting up, and main got 1, 2, 6, 24, 120, which are n!. The claim is scoped to n from 1 to 5.", "evidence": ["fact f.n1.out", "fact f.n2.out", "fact f.out", "fact f.n4.out", "fact f.n5.out"]},
    {"id": "c.kbase1", "verdict": "accept", "reason": "Explanation: in fact_n1.c, line 7 never runs, so factorial(1) makes no further call to factorial and returns 1. That matches f.n1.out.", "evidence": ["programs/fact_n1.c lines 5-9", "fact f.n1.out"]}
  ],
  "texts": [
    {"id": "t.001", "verdict": "accept", "reason": "Same as the first sentence of c.frame."},
    {"id": "t.002", "verdict": "accept", "reason": "Same as c.order."},
    {"id": "t.003", "verdict": "accept", "reason": "Same as the second sentence of c.frame, and it is scoped to the drawing."},
    {"id": "t.088", "verdict": "accept", "reason": "A true-or-false card whose statement is c.frame, which is true."},
    {"id": "t.089", "verdict": "accept", "reason": "Presents m.base, which is false: main gets 6, not 1."},
    {"id": "t.090", "verdict": "accept", "reason": "Presents m.firstdone, which is false: factorial(3) prints its result last."},
    {"id": "t.091", "verdict": "accept", "reason": "Presents m.once, which is false: factorial(3) returns 6."},
    {"id": "t.092", "verdict": "accept", "reason": "Presents m.zero, which is false: the recursion stops at factorial(1)."},
    {"id": "t.093", "verdict": "accept", "reason": "Same as c.base."},
    {"id": "t.094", "verdict": "accept", "reason": "Same as c.depth."},
    {"id": "t.095", "verdict": "accept", "reason": "Same as c.frame."},
    {"id": "t.096", "verdict": "accept", "reason": "Same as c.kbase1."},
    {"id": "t.097", "verdict": "accept", "reason": "Same as c.korder."},
    {"id": "t.098", "verdict": "accept", "reason": "Same as c.main."},
    {"id": "t.099", "verdict": "accept", "reason": "Same as c.order."},
    {"id": "t.100", "verdict": "accept", "reason": "Same as c.ret3."},
    {"id": "t.101", "verdict": "accept", "reason": "Same as c.setup."},
    {"id": "t.102", "verdict": "accept", "reason": "Same as c.slot."},
    {"id": "t.103", "verdict": "accept", "reason": "Same as c.unwind."},
    {"id": "t.104", "verdict": "accept", "reason": "Same as c.waits."},
    {"id": "t.182", "verdict": "accept", "reason": "The scene title fits sc7, where factorial(3) returns 6 to main."},
    {"id": "t.183", "verdict": "accept", "reason": "The scene title matches c.unwind's 'one frame down'."},
    {"id": "t.184", "verdict": "accept", "reason": "The scene title matches c.frame's drawing rule."},
    {"id": "t.185", "verdict": "accept", "reason": "A neutral scene title."},
    {"id": "t.186", "verdict": "accept", "reason": "A neutral scene title."},
    {"id": "t.187", "verdict": "accept", "reason": "Matches c.base."},
    {"id": "t.188", "verdict": "accept", "reason": "Three factorial frames are active, which matches c.depth."},
    {"id": "t.189", "verdict": "accept", "reason": "Matches c.setup and line 13."},
    {"id": "t.190", "verdict": "accept", "reason": "Matches c.main."},
    {"id": "t.204", "verdict": "accept", "reason": "The title agrees with c.frame, which says the lesson draws calls as frames on a call stack."},
    {"id": "t.205", "verdict": "accept", "reason": "Labelled as a wrong belief, and m.base is false."},
    {"id": "t.206", "verdict": "accept", "reason": "Labelled as a wrong belief, and m.firstdone is false."},
    {"id": "t.207", "verdict": "accept", "reason": "Labelled as a wrong belief, and m.zero is false."},
    {"id": "t.208", "verdict": "accept", "reason": "Same as c.setup."},
    {"id": "t.209", "verdict": "accept", "reason": "Same as c.frame."},
    {"id": "t.210", "verdict": "accept", "reason": "Same as c.waits, with 'Now' added."},
    {"id": "t.211", "verdict": "accept", "reason": "Same as c.slot."},
    {"id": "t.212", "verdict": "accept", "reason": "Same as c.depth, with 'Then' added."},
    {"id": "t.213", "verdict": "reject", "reason": "Media and portability: this line also appears in transcript.txt, but the answer choices aren't in the transcript and nothing plays there. 'Choose your answer before the answer plays' only works in the video. Reword it for the transcript, for example 'Predict line 4 before reading on.'"},
    {"id": "t.214", "verdict": "accept", "reason": "Same as c.base."},
    {"id": "t.215", "verdict": "accept", "reason": "Same as c.unwind."},
    {"id": "t.216", "verdict": "accept", "reason": "Same as c.ret3, with 'Then' added."},
    {"id": "t.217", "verdict": "accept", "reason": "Same as c.main."},
    {"id": "t.218", "verdict": "accept", "reason": "Same as c.order."},
    {"id": "t.219", "verdict": "accept", "reason": "Same as the first sentence of c.recap, and the drawing scope is kept."},
    {"id": "t.220", "verdict": "accept", "reason": "Same as the second sentence of c.recap."},
    {"id": "t.221", "verdict": "accept", "reason": "Marked wrong, and it is wrong: line 4 is factorial(1) = 1, while factorial(3) = 6 is line 6."},
    {"id": "t.222", "verdict": "accept", "reason": "Marked correct, and it matches f.l4."},
    {"id": "t.223", "verdict": "accept", "reason": "Marked wrong, and it is wrong: factorial(0) is never called."},
    {"id": "t.224", "verdict": "accept", "reason": "The prompt doesn't give away f.l4."},
    {"id": "t.225", "verdict": "accept", "reason": "True for s0: main is waiting on line 13 and factorial(3) is running."},
    {"id": "t.226", "verdict": "accept", "reason": "True for s1: the factorial(3) frame is waiting on line 7 while factorial(2) runs."},
    {"id": "t.227", "verdict": "accept", "reason": "True for s2: three factorial frames sit above main."},
    {"id": "t.228", "verdict": "accept", "reason": "True for s3: factorial(1) is returning f.ret1 = 1."},
    {"id": "t.229", "verdict": "accept", "reason": "True for s4: factorial(2) is returning 2."},
    {"id": "t.230", "verdict": "accept", "reason": "True for s5: factorial(3) is returning 6."},
    {"id": "t.231", "verdict": "accept", "reason": "True for s6: main is on line 14, has 6, and f.l7 is printed."}
  ],
  "overall": "reject"
}
