{
  "schema": "prax-teach/claims-review@1",
  "job_id": "job-fe6fdf9077",
  "manifest_sha256": "fe6fdf90774382ac2039c65eb5a7464c1dfe84060b7f821d0ad5acb2feabc896",
  "rubric_version": "3",
  "reviewer": {"host": "claude-code", "agent": "claims reviewer subagent (Opus 5.5), job and rubric only"},
  "claims": [
    {"id": "c.formula", "verdict": "accept", "reason": "Explanation: lines 8, 10, 12 and 14 multiply, sum with b, and apply fmax(0.0, z), which matches ReLU as max{0, z}. The framing stays scoped to this neuron.", "evidence": ["programs/neuron.c lines 8-14", "Deep Learning §6.3.1"]},
    {"id": "c.setup", "verdict": "accept", "reason": "Maths: lines 5-7 set 0.8, 1.5, 0.4, -1.0 and -0.2, and %g prints -1.0 as -1. All five facts match.", "evidence": ["fact f.x1", "fact f.w1", "fact f.x2", "fact f.w2", "fact f.b"]},
    {"id": "c.mul", "verdict": "reject", "reason": "Sources: the claim and its values are right, but the quote isn't verbatim. C17 7.21.6.1p8 says 'style f (or F)', and the quote drops '(or F)' without marking the cut. The quoted rule on its own also gives +1.20000. The plus sign shows only as +1.2 because of the next sentence in the same paragraph, which removes trailing zeros, and neither the quote nor the justification mentions it. Quote the clause exactly and include the trailing-zero sentence.", "evidence": ["C17 §7.21.6.1 ¶8", "fact f.t1", "fact f.t2"]},
    {"id": "c.sign", "verdict": "accept", "reason": "Explanation: scoped with 'Here'. 0.4 * -1.0 is the negated double of 0.4, which prints as -0.4.", "evidence": ["fact f.t2", "programs/neuron.c line 10"]},
    {"id": "c.add", "verdict": "accept", "reason": "Maths: (1.2000000000000002 + -0.4) + -0.2 rounds (ties to even) to the double just above 0.6, 0.6000000000000001, and %g prints that as 0.6. The claim states only printed values and names the addition as the mechanism.", "evidence": ["fact f.z", "programs/neuron.c lines 12-13", "C17 §7.21.6.1 ¶8"]},
    {"id": "c.relu", "verdict": "accept", "reason": "Explanation: the claim matches the max{0, z} definition, and the fmax quote is the real Returns paragraph of 7.12.12.2.", "evidence": ["Deep Learning §6.3.1", "C17 §7.12.12.2 ¶3"]},
    {"id": "c.out", "verdict": "accept", "reason": "Explanation: z is the positive double 0.6000000000000001, so fmax returns z, and line 15 prints it as 0.6. Scoped with 'Here', and paired with c.add and c.relu as the mechanism.", "evidence": ["fact f.a", "programs/neuron.c lines 14-15", "C17 §7.12.12.2 ¶3"]},
    {"id": "c.toy", "verdict": "accept", "reason": "Explanation: every quantity is double, and lines 9, 11, 13 and 15 use %g or %+g with no precision, so they show at most 6 significant digits.", "evidence": ["programs/neuron.c lines 5-15", "C17 §7.21.6.1 ¶8"]},
    {"id": "c.pause", "verdict": "accept", "reason": "Kind fits: a prediction prompt that makes no technical claim.", "evidence": ["learner workspace contract, Teaching"]},
    {"id": "c.round", "verdict": "accept", "reason": "Maths: 0.8*1.5 is the tie 5404319552844595.5/2^52, which rounds to even to 1.2000000000000002, not the double 1.2. z comes out one ulp above the double 0.6, so z == 0.6 is false. 0.6 has no exact binary64 form, and %g prints 0.6. The claim is scoped to this machine.", "evidence": ["fact f.z", "C17 §7.21.6.1 ¶8", "C17 §F.2 ¶1"]},
    {"id": "c.kzero", "verdict": "accept", "reason": "Maths: in p2, 0.8000000000000002 + -1.0 is exactly -0.19999999999999984, which prints as -0.2, and fmax(0.0, z) gives 0. The 'ReLU sees only the sum' mechanism is correct.", "evidence": ["fact f.k1.t1", "fact f.k1.z", "fact f.k1.a"]}
  ],
  "texts": [
    {"id": "t.001", "verdict": "accept", "reason": "Same words as c.toy."},
    {"id": "t.002", "verdict": "accept", "reason": "Same words as c.toy."},
    {"id": "t.003", "verdict": "accept", "reason": "Same words as c.formula."},
    {"id": "t.081", "verdict": "accept", "reason": "True-or-false card whose statement is c.relu, which is true."},
    {"id": "t.082", "verdict": "accept", "reason": "True-or-false card whose statement is c.round, which is true."},
    {"id": "t.083", "verdict": "accept", "reason": "Shows m.negterm as a true-or-false card. The belief is false: t2 is negative here, yet a is 0.6."},
    {"id": "t.084", "verdict": "accept", "reason": "Shows m.nobias as a true-or-false card. The belief is false: the bias is part of z."},
    {"id": "t.085", "verdict": "accept", "reason": "Same words as c.add."},
    {"id": "t.086", "verdict": "accept", "reason": "Same words as c.formula."},
    {"id": "t.087", "verdict": "accept", "reason": "Same words as c.kzero, and it matches the p2 facts."},
    {"id": "t.088", "verdict": "accept", "reason": "Same words as c.mul. The text is true and matches facts f.t1 and f.t2. The c.mul reject is about its quote, not this wording."},
    {"id": "t.089", "verdict": "accept", "reason": "Same words as c.out."},
    {"id": "t.090", "verdict": "accept", "reason": "Same words as c.relu."},
    {"id": "t.091", "verdict": "accept", "reason": "Same words as c.setup."},
    {"id": "t.092", "verdict": "accept", "reason": "Same words as c.sign."},
    {"id": "t.093", "verdict": "accept", "reason": "Same words as c.toy."},
    {"id": "t.166", "verdict": "accept", "reason": "Scene title names the add step without overstating it."},
    {"id": "t.167", "verdict": "accept", "reason": "Scene title names the ReLU gate step."},
    {"id": "t.168", "verdict": "accept", "reason": "Scene title names the multiply step."},
    {"id": "t.169", "verdict": "accept", "reason": "Multiply, add and gate are three steps, which matches c.formula."},
    {"id": "t.170", "verdict": "accept", "reason": "Scene title for the prediction question, with no claim in it."},
    {"id": "t.171", "verdict": "accept", "reason": "Neutral scene title."},
    {"id": "t.183", "verdict": "accept", "reason": "Lesson title, no overstatement."},
    {"id": "t.184", "verdict": "accept", "reason": "Labelled as a wrong belief, and it really is false here."},
    {"id": "t.185", "verdict": "accept", "reason": "Labelled as a wrong belief, and it really is false, since b is in the sum."},
    {"id": "t.186", "verdict": "accept", "reason": "Same words as c.formula."},
    {"id": "t.187", "verdict": "accept", "reason": "Same words as c.setup."},
    {"id": "t.188", "verdict": "accept", "reason": "Same meaning as c.mul, split into two sentences, and true against the facts."},
    {"id": "t.189", "verdict": "accept", "reason": "Same words as c.sign."},
    {"id": "t.190", "verdict": "accept", "reason": "Same words as c.pause, and it doesn't rely on one medium."},
    {"id": "t.191", "verdict": "accept", "reason": "Same words as c.add."},
    {"id": "t.192", "verdict": "accept", "reason": "Same words as c.relu."},
    {"id": "t.193", "verdict": "accept", "reason": "Same words as c.out."},
    {"id": "t.194", "verdict": "accept", "reason": "First half of c.round, with the platform scope kept."},
    {"id": "t.195", "verdict": "accept", "reason": "Second half of c.round. It refers to this program's z."},
    {"id": "t.196", "verdict": "accept", "reason": "Same words as c.formula."},
    {"id": "t.197", "verdict": "accept", "reason": "Marked wrong, and it is wrong: a prints 0.6, not 0.8."},
    {"id": "t.198", "verdict": "accept", "reason": "Marked wrong, and it is wrong: z is positive, so a is not 0."},
    {"id": "t.199", "verdict": "accept", "reason": "Marked correct, and it matches fact f.a."},
    {"id": "t.200", "verdict": "accept", "reason": "The prompt doesn't give away 0.6."},
    {"id": "t.201", "verdict": "accept", "reason": "True for state s0: the path covers lines 5-7, which set the inputs, weights and bias, and nothing is printed yet."},
    {"id": "t.202", "verdict": "accept", "reason": "True for state s1: lines 8-11 compute and print both products."},
    {"id": "t.203", "verdict": "accept", "reason": "True for state s2: line 12 sums t1, t2 and b, and line 13 prints z."},
    {"id": "t.204", "verdict": "accept", "reason": "True for state s3: line 14 applies fmax(0.0, z), and line 15 prints a."}
  ],
  "overall": "reject"
}
