{
  "schema": "prax-teach/claims-review@1",
  "job_id": "job-88da7dc59a",
  "manifest_sha256": "88da7dc59ab97efab850aa0432c53e2c67339668494bab28c0b218b0da5f51b9",
  "rubric_version": "3",
  "reviewer": {"host": "claude-code", "agent": "claims reviewer subagent (Opus 5.5)"},
  "claims": [
    {"id": "c.formula", "verdict": "accept", "reason": "Explanation: lines 8, 10, 12 and 14 do multiply, sum with b and apply fmax(0.0, z). The ReLU quote matches the cited section, and the sentence is scoped to this neuron.", "evidence": ["programs/neuron.c lines 8-14", "Deep Learning §6.3.1"]},
    {"id": "c.setup", "verdict": "accept", "reason": "Maths: lines 5-7 set 0.8, 1.5, 0.4, -1.0 and -0.2, and the stated values match the facts.", "evidence": ["fact f.x1", "fact f.w1", "fact f.x2", "fact f.w2", "fact f.b"]},
    {"id": "c.mul", "verdict": "accept", "reason": "Maths: 0.8*1.5 rounds (tie to even) to 1.2000000000000002, which %+g prints as +1.2. 0.4*-1 is exact, so it equals the double -0.4. The justification and the g-style quote are correct.", "evidence": ["fact f.t1", "fact f.t2", "C17 §7.21.6.1 ¶8"]},
    {"id": "c.sign", "verdict": "accept", "reason": "Explanation: scoped with 'here'. A positive times a negative gives a negative, and t2 prints as -0.4.", "evidence": ["fact f.t2"]},
    {"id": "c.add", "verdict": "accept", "reason": "Maths: I recomputed (t1 + t2) + b left to right. It lands one ulp above 0.6 (0.6000000000000001), and %g prints it as 0.6. The sentence only states printed values.", "evidence": ["fact f.z", "fact f.l3", "C17 §7.21.6.1 ¶8"]},
    {"id": "c.relu", "verdict": "accept", "reason": "Explanation: it matches the ReLU definition and fmax's return rule. Positive z returns z, and z <= 0 gives 0.", "evidence": ["Deep Learning §6.3.1", "C17 §7.12.12.2 ¶3"]},
    {"id": "c.out", "verdict": "accept", "reason": "Explanation: z is positive, so fmax(0.0, z) returns z, and line 15 prints 0.6. The mechanism is stated and scoped with 'here'.", "evidence": ["fact f.a", "fact f.l4", "C17 §7.12.12.2"]},
    {"id": "c.toy", "verdict": "accept", "reason": "Explanation: every quantity is double. %g and %+g with the default precision give at most 6 significant digits, and the printf lines are 9, 11, 13 and 15.", "evidence": ["C17 §7.21.6.1 ¶8"]},
    {"id": "c.pause", "verdict": "accept", "reason": "Kind fits: it is a pure prompt to predict and makes no technical claim.", "evidence": []},
    {"id": "c.round", "verdict": "accept", "reason": "Maths and caveat: it is scoped to binary64 on this machine. t1 is the double just above 1.2 and z is the double just above 0.6, so z == 0.6 is false, and %g prints 0.6. Every step in the justification checks out.", "evidence": ["fact f.z", "C17 §7.21.6.1 ¶8", "C17 §F.2 ¶1"]},
    {"id": "c.kzero", "verdict": "accept", "reason": "Maths: with b = -1, z is exactly -0.19999999999999984 (Sterbenz subtraction), which prints as -0.2, and fmax returns 0. The point that ReLU sees only the sum is correct.", "evidence": ["fact f.k1.t1", "fact f.k1.z", "fact f.k1.a"]}
  ],
  "texts": [
    {"id": "t.001", "verdict": "accept", "reason": "First half of c.toy, unchanged."},
    {"id": "t.002", "verdict": "accept", "reason": "Second half of c.toy, unchanged."},
    {"id": "t.003", "verdict": "accept", "reason": "Same wording as c.formula."},
    {"id": "t.081", "verdict": "accept", "reason": "A true-or-false card built from a true claim, c.relu."},
    {"id": "t.082", "verdict": "accept", "reason": "A true-or-false card built from a true claim, c.round."},
    {"id": "t.083", "verdict": "accept", "reason": "The belief is false (z, not any single term, decides ReLU), and the card asks about it instead of asserting it."},
    {"id": "t.084", "verdict": "accept", "reason": "The belief is false (the bias makes z 0.6, not 0.8), and the card asks about it instead of asserting it."},
    {"id": "t.085", "verdict": "accept", "reason": "Same wording as c.add."},
    {"id": "t.086", "verdict": "accept", "reason": "Same wording as c.formula."},
    {"id": "t.087", "verdict": "accept", "reason": "Same wording as c.kzero, and it matches the p2 facts."},
    {"id": "t.088", "verdict": "accept", "reason": "Same wording as c.mul."},
    {"id": "t.089", "verdict": "accept", "reason": "Same wording as c.out."},
    {"id": "t.090", "verdict": "accept", "reason": "Same wording as c.relu."},
    {"id": "t.091", "verdict": "accept", "reason": "Same wording as c.setup."},
    {"id": "t.092", "verdict": "accept", "reason": "Same wording as c.sign."},
    {"id": "t.093", "verdict": "accept", "reason": "Same wording as c.toy."},
    {"id": "t.166", "verdict": "accept", "reason": "Scene title matches the add step."},
    {"id": "t.167", "verdict": "accept", "reason": "Scene title matches the ReLU gate step."},
    {"id": "t.168", "verdict": "accept", "reason": "Scene title matches the multiply step."},
    {"id": "t.169", "verdict": "accept", "reason": "Multiply, add and gate are three steps, which matches c.formula."},
    {"id": "t.170", "verdict": "accept", "reason": "Scene title for the prediction question, which makes no claim."},
    {"id": "t.171", "verdict": "accept", "reason": "Neutral scene title."},
    {"id": "t.183", "verdict": "accept", "reason": "The lesson title doesn't overstate anything."},
    {"id": "t.184", "verdict": "accept", "reason": "The belief is false and is labelled as a wrong belief."},
    {"id": "t.185", "verdict": "accept", "reason": "The belief is false and is labelled as a wrong belief."},
    {"id": "t.186", "verdict": "accept", "reason": "The narration matches c.formula."},
    {"id": "t.187", "verdict": "accept", "reason": "The narration matches c.setup."},
    {"id": "t.188", "verdict": "accept", "reason": "The narration matches c.mul. Only the punctuation differs."},
    {"id": "t.189", "verdict": "accept", "reason": "The narration matches c.sign."},
    {"id": "t.190", "verdict": "accept", "reason": "The narration matches c.pause, and it doesn't depend on one medium."},
    {"id": "t.191", "verdict": "accept", "reason": "The narration matches c.add."},
    {"id": "t.192", "verdict": "accept", "reason": "The narration matches c.relu."},
    {"id": "t.193", "verdict": "accept", "reason": "The narration matches c.out."},
    {"id": "t.194", "verdict": "accept", "reason": "First part of c.round, and it keeps the binary64 qualifier."},
    {"id": "t.195", "verdict": "accept", "reason": "Second part of c.round, unchanged."},
    {"id": "t.196", "verdict": "accept", "reason": "The narration matches c.formula."},
    {"id": "t.197", "verdict": "accept", "reason": "0.8 is marked wrong and is wrong. It is the answer you get if you drop the bias."},
    {"id": "t.198", "verdict": "accept", "reason": "0 is marked wrong and is wrong, because z is positive."},
    {"id": "t.199", "verdict": "accept", "reason": "0.6 is marked correct and matches f.a."},
    {"id": "t.200", "verdict": "accept", "reason": "The prompt doesn't give away the answer."},
    {"id": "t.201", "verdict": "accept", "reason": "At s0, lines 5-7 have set the inputs, weights and bias."},
    {"id": "t.202", "verdict": "accept", "reason": "At s1, lines 8-11 have done the multiplications and printed them."},
    {"id": "t.203", "verdict": "accept", "reason": "At s2, line 12 has summed the terms and b, and line 13 has printed z."},
    {"id": "t.204", "verdict": "accept", "reason": "At s3, line 14 has applied fmax(0.0, z) and line 15 has printed a."}
  ],
  "overall": "accept"
}
